slug,title,title_length,title_keyword_present,title_unique,meta_desc,meta_desc_length,meta_keyword_present,meta_unique,canonical_url,total_issues
phd-full-form-doctorate-meaning-india,,0,no,yes,,0,no,yes,https://edifyedu.in/blog/phd-full-form-doctorate-meaning-india,4
14-principles-of-management-henri-fayol,,0,no,yes,,0,no,yes,https://edifyedu.in/blog/14-principles-of-management-henri-fayol,4
cat-exam-syllabus-2026-complete-guide,,0,no,yes,,0,no,yes,https://edifyedu.in/blog/cat-exam-syllabus-2026-complete-guide,4
career-objective-for-fresher-resume-examples,,0,no,yes,,0,no,yes,https://edifyedu.in/blog/career-objective-for-fresher-resume-examples,4
best-computer-courses-after-12th-india-2026,,0,no,yes,,0,no,yes,https://edifyedu.in/blog/best-computer-courses-after-12th-india-2026,4
courses-after-12th-science-complete-list-2026,,0,no,yes,,0,no,yes,https://edifyedu.in/blog/courses-after-12th-science-complete-list-2026,4
iim-ranking-india-2026-all-iims-list,,0,no,yes,,0,no,yes,https://edifyedu.in/blog/iim-ranking-india-2026-all-iims-list,4
toughest-exams-india-world-2026,,0,no,yes,,0,no,yes,https://edifyedu.in/blog/toughest-exams-india-world-2026,4
ias-officer-salary-india-2026-pay-scale-perks,,0,no,yes,,0,no,yes,https://edifyedu.in/blog/ias-officer-salary-india-2026-pay-scale-perks,4
cyber-security-salary-india-2026-career-guide,,0,no,yes,,0,no,yes,https://edifyedu.in/blog/cyber-security-salary-india-2026-career-guide,4
data-science-salary-india-2026-scope-jobs,,0,no,yes,,0,no,yes,https://edifyedu.in/blog/data-science-salary-india-2026-scope-jobs,4
investment-banking-career-india-salary-qualification,,0,no,yes,,0,no,yes,https://edifyedu.in/blog/investment-banking-career-india-salary-qualification,4
arts-stream-jobs-career-options-salary-india,,0,no,yes,,0,no,yes,https://edifyedu.in/blog/arts-stream-jobs-career-options-salary-india,4
commerce-jobs-list-salary-india-2026,,0,no,yes,,0,no,yes,https://edifyedu.in/blog/commerce-jobs-list-salary-india-2026,4
bsc-career-options-scope-salary-india-2026,,0,no,yes,,0,no,yes,https://edifyedu.in/blog/bsc-career-options-scope-salary-india-2026,4
gd-topics-for-mba-2026-with-answers,,0,no,yes,,0,no,yes,https://edifyedu.in/blog/gd-topics-for-mba-2026-with-answers,4
llm-course-duration-fees-scope-india-2026,,0,no,yes,,0,no,yes,https://edifyedu.in/blog/llm-course-duration-fees-scope-india-2026,4
distance-mba-kerala-programs-2026,Exploring Distance MBA Programs in Kerala 2026 — Top Universities & Admission Guide,83,yes,yes,"Distance MBA in Kerala 2026 — UGC-approved programs, fees, top colleges, and how Kerala professional...",131,yes,yes,https://edifyedu.in/blog/distance-mba-kerala-programs-2026,3
mba-finance-career-salary-scope-2026,"MBA Finance Career, Salary and Scope in India 2026: Complete Guide",66,yes,yes,"MBA Finance career scope, salary, and top job roles in India 2026. From investment banking to fintec...",196,yes,yes,https://edifyedu.in/blog/mba-finance-career-salary-scope-2026,3
dsu-online-mba-review,"Dayananda Sagar University Online MBA 2026: Fees, Syllabus, Honest Review",73,no,yes,"DSU Online MBA at Rs. 1,30,000 total (Rs. 32,875 first semester, Rs. 32,375 per semester for semeste...",224,yes,yes,https://edifyedu.in/blog/dsu-online-mba-review,3
bcom-full-form-course-details-eligibility-fees-2026,"B.Com Full Form: What is B.Com, Course Details, Subjects, Fees, Salary 2026",75,no,yes,"B.Com stands for Bachelor of Commerce. Full guide on B.Com course, subjects, eligibility, fees (5K-2...",145,no,yes,https://edifyedu.in/blog/bcom-full-form-course-details-eligibility-fees-2026,3
btech-full-form-course-details-eligibility-fees-2026,"B.Tech Full Form: What is B.Tech, Branches, Fees, Eligibility, Salary 2026",74,no,yes,"B.Tech stands for Bachelor of Technology. Full guide on B.Tech branches, eligibility, fees (1-20L), ...",151,no,yes,https://edifyedu.in/blog/btech-full-form-course-details-eligibility-fees-2026,3
online-bba-programs-india-2026,Best Online BBA Programs India 2026: Tier 1 vs Tier 2 vs Tier 3 Ranked,70,no,yes,"Best online BBA programs India 2026: tier 1 (NMIMS, MAHE, Symbiosis) vs tier 2 (LPU, Amity) vs tier ...",160,no,yes,https://edifyedu.in/blog/online-bba-programs-india-2026,3
online-mba-entrepreneurship-india-2026,Online MBA Entrepreneurship India 2026: Fees & Universities,59,no,yes,"Online MBA Entrepreneurship 2026 — 4 UGC-DEB universities (DSU ₹1.2L, Chandigarh ₹1.65L, JAIN ₹1.75L...",163,no,yes,https://edifyedu.in/blog/online-mba-entrepreneurship-india-2026,3
online-mba-event-management-india-2026,MBA in Event Management Online India 2026: Universities & Fees,62,no,yes,"MBA In Event Management Online 2026: Online MBA in Event Management 2026 — fees ₹1.65L–₹1.76L, only ...",165,no,yes,https://edifyedu.in/blog/online-mba-event-management-india-2026,3
online-mba-supply-chain-management-india-2026,MBA Supply Chain Management Online India 2026: 10 Universities,62,no,yes,MBA Supply Chain Management Online 2026: Online MBA Supply Chain Management 2026 — 10 UGC-DEB univer...,165,no,yes,https://edifyedu.in/blog/online-mba-supply-chain-management-india-2026,3
amity-online-mba-hr-worth-it,Is Amity University Online MBA in HR Worth It? Real Talk from Someone Who Researched It,87,yes,yes,"Amity University online MBA HR review 2026 — fees, HR+Finance dual specialisation, NAAC A+ accredita...",142,yes,yes,https://edifyedu.in/blog/amity-online-mba-hr-worth-it,2
how-to-choose-online-mba-university-india-2026,How to Choose the Right Online MBA University in India in 2026 (Step-by-Step),77,yes,yes,How to choose online MBA university in India 2026 — 8 criteria that separate genuine programs from e...,122,yes,yes,https://edifyedu.in/blog/how-to-choose-online-mba-university-india-2026,2
career-after-mba-jobs-salary-scope-2026,"Career After MBA 2026: Top 10 Highest-Paying Jobs, Salary Data and Scope in India",81,yes,yes,"Career after MBA in India 2026 - top 10 highest paying MBA jobs, real salary data by specialization,...",172,yes,yes,https://edifyedu.in/blog/career-after-mba-jobs-salary-scope-2026,2
iim-online-mba-india-2026,"IIM Online MBA 2026: Kozhikode, Bangalore, Calcutta Fees, Eligibility and Worth It?",83,yes,yes,"Complete guide to IIM online MBA in India 2026. Compare IIM Kozhikode EPGM, IIM Bangalore EPGP, IIM ...",179,yes,yes,https://edifyedu.in/blog/iim-online-mba-india-2026,2
govt-jobs-after-mba-india-2026,"Government Jobs After MBA 2026: PSU, Bank PO, UPSC and More (Full List)",71,no,yes,"Govt jobs after MBA in India 2026: PSU, UPSC, banking, and government sector roles available to MBA ...",130,yes,yes,https://edifyedu.in/blog/govt-jobs-after-mba-india-2026,2
career-after-12th-science-courses-jobs-2026,"Career After 12th Science 2026: Top 15 Options, BCA vs B.Sc vs B.Tech and Salary Data",85,yes,yes,"Career after 12th science 2026 - top 15 options beyond engineering and medicine, BCA vs B.Sc vs B.Te...",183,yes,yes,https://edifyedu.in/blog/career-after-12th-science-courses-jobs-2026,2
mba-hr-career-salary-scope-2026,"MBA HR Career, Salary and Scope in India 2026: Is It Worth Choosing?",68,yes,yes,"MBA HR career salary and scope 2026 — roles, average packages, top companies hiring MBA HR graduates...",138,yes,yes,https://edifyedu.in/blog/mba-hr-career-salary-scope-2026,2
mba-for-commerce-students-india-2026,MBA for Commerce Students in India 2026: Best Specialisations and Career Paths,78,yes,yes,"MBA for commerce students in India 2026 — best specialisations after B.Com, fees, top colleges, and ...",139,yes,yes,https://edifyedu.in/blog/mba-for-commerce-students-india-2026,2
online-mba-courses-chennai-2026,"Online MBA Courses in Chennai 2026: Top Programs, UGC DEB and Fees",66,yes,yes,"Top online MBA courses in Chennai 2026. Compare Annamalai University, University of Madras, IGNOU, A...",201,yes,yes,https://edifyedu.in/blog/online-mba-courses-chennai-2026,2
mba-course-duration-india-2026,MBA Course Duration in India: The Definitive Guide for Every Format,67,yes,yes,"MBA course duration in India: full-time 2 years, executive 12-18 months, online 2 years extendable, ...",173,yes,yes,https://edifyedu.in/blog/mba-course-duration-india-2026,2
smu-online-mba-review,"Sikkim Manipal University Online MBA 2026: Fees, Dual Specialization, Syllabus and Honest Review",96,no,yes,"Sikkim Manipal University (SMU) Online MBA fees 2026: ₹1,20,000 total. NAAC A+ (3.28), UGC-DEB appro...",156,yes,yes,https://edifyedu.in/blog/smu-online-mba-review,2
arka-jain-online-mba-review,"ARKA JAIN University JGI Online MBA 2026: Fees, GenAI Syllabus and Honest Review",80,yes,yes,"ARKA JAIN JGI Online MBA at Rs. 1,08,500 total. The only affordable online MBA with Generative AI co...",171,yes,yes,https://edifyedu.in/blog/arka-jain-online-mba-review,2
jaypee-jiit-online-mba-review,"Jaypee JIIT Online MBA 2026: Fees, IT Business Analytics, AI in Business and Honest Review",90,yes,yes,"Jaypee Institute of Information Technology Online MBA at Rs 1,75,000. Engineering college MBA built ...",259,yes,yes,https://edifyedu.in/blog/jaypee-jiit-online-mba-review,2
amity-online-bba-fees-2026,"Amity Online BBA Fees 2026: ₹1,75,120 One-Time + 0% EMI",55,no,yes,"Amity Online BBA fees 2026: ₹1,75,120 One-Time / ₹7,877/mo 0% EMI / ₹33,200 sem. Scholarships, compa...",148,no,yes,https://edifyedu.in/blog/amity-online-bba-fees-2026,2
amity-online-bba-review-2026,"Amity Online BBA Review 2026: Fees, Curriculum & Honest Take",60,no,yes,"Amity Online BBA review 2026: ₹1,75,120 One-Time / ₹33,200 sem / 0% EMI ₹7,877 monthly. UGC-DEB, NAA...",146,no,yes,https://edifyedu.in/blog/amity-online-bba-review-2026,2
bits-pilani-online-mba-review-2026,BITS Pilani Online MBA Review 2026: WILP Fees & Honest Take,59,no,yes,"Bits Pilani Online MBA 2026: BITS Pilani WILP Online MBA 2026 review: ₹2.97L total fee. NAAC A++, NI...",165,no,yes,https://edifyedu.in/blog/bits-pilani-online-mba-review-2026,2
imt-ghaziabad-online-mba-review-2026,IMT Ghaziabad Online MBA Review 2026: CDL PGDM Fees & Take,58,no,yes,Imt Ghaziabad Online MBA 2026: IMT Ghaziabad CDL Online MBA 2026 review: ₹2.20L AICTE PGDM (not UGC-...,165,no,yes,https://edifyedu.in/blog/imt-ghaziabad-online-mba-review-2026,2
jain-online-mba-review-2026,"JAIN Online MBA Review 2026: Fees, 18 Specs & Honest Take",57,no,yes,Jain Online MBA 2026: JAIN University Online MBA 2026 honest review: Fees ₹1.96L to ₹2.98L across 18...,165,no,yes,https://edifyedu.in/blog/jain-online-mba-review-2026,2
mba-hr-management-online-india-2026,MBA HR Management Online India 2026: 25+ Unis Compared,54,no,yes,MBA HR Management Online 2026: MBA in HR Management online 2026: 25+ UGC-DEB universities compared. ...,165,no,yes,https://edifyedu.in/blog/mba-hr-management-online-india-2026,2
mba-pharmaceutical-management-online-india-2026,MBA Pharmaceutical Management Online 2026: Fees & Take,54,no,yes,"MBA Pharmaceutical Management online 2026: 3 UGC-DEB universities compared. Shoolini ₹1.3L net, Chit...",155,no,yes,https://edifyedu.in/blog/mba-pharmaceutical-management-online-india-2026,2
online-bba-degree-india-validity-2026,Online BBA Degree in India 2026: Valid? Recognition & Jobs,58,no,yes,"Online BBA degree in India 2026: Is it valid? UGC-DEB legal status, jobs at TCS/Infosys/Amazon, MBA ...",157,no,yes,https://edifyedu.in/blog/online-bba-degree-india-validity-2026,2
online-bba-in-india-2026,"Online BBA in India 2026: Top Colleges, Fees and Career Guide",61,no,yes,"Online BBA in India 2026: top colleges, fees from ₹1.2L to ₹2.4L, career scope and salary data. Comp...",149,no,yes,https://edifyedu.in/blog/online-bba-in-india-2026,2
online-mba-aviation-management-india-2026,MBA in Aviation Management Online India 2026: Fees & Universities,65,no,yes,MBA In Aviation Management Online 2026: Online MBA Aviation Management 2026: Chandigarh Airlines & A...,165,no,yes,https://edifyedu.in/blog/online-mba-aviation-management-india-2026,2
online-mba-business-data-analytics-india-2026,Online MBA in Business Analytics in India 2026: 16+ Unis,56,no,yes,Online MBA In Business Analytics In India 2026: Online MBA Business Analytics & Data Analytics India...,165,no,yes,https://edifyedu.in/blog/online-mba-business-data-analytics-india-2026,2
online-mba-hospital-healthcare-management-india-2026,Online MBA Hospital Administration India 2026: 8 Universities,61,no,yes,Online MBA Hospital Administration & Healthcare Management India 2026: 8 UGC-DEB universities. Fees ...,147,no,yes,https://edifyedu.in/blog/online-mba-hospital-healthcare-management-india-2026,2
upes-online-mba-review-2026,"UPES Online MBA Review 2026: Fees, 11 Specs & Honest Take",57,no,yes,"UPES Online MBA 2026 honest review: ₹1.75L total fee. UGC-DEB, NAAC A, NIRF #52 mgmt. 11 specs with ...",147,no,yes,https://edifyedu.in/blog/upes-online-mba-review-2026,2
xlri-online-mba-review-2026,XLRI Online MBA Review 2026: ₹14.4L Worth It? Honest Take,57,no,yes,"XLRI Online MBA 2026: ₹14.4L PGDM (not UGC-DEB MBA). 3+ yrs exp required, AACSB/AMBA accredited, NIR...",147,no,yes,https://edifyedu.in/blog/xlri-online-mba-review-2026,2
online-bba-india-2026,"Online BBA India 2026: Eligibility, Admission Process and Documents",67,yes,yes,"Online BBA India 2026: eligibility (10+2 any stream), admission process, documents required and seme...",176,yes,yes,https://edifyedu.in/blog/online-bba-india-2026,2
is-online-mba-worth-it-2026,Is Online MBA Worth It in 2026? The Honest Truth Nobody Tells You,65,yes,yes,"Is an online MBA worth it in 2026? We break down UGC recognition, real ROI, who should do it—and who...",147,yes,yes,https://edifyedu.in/blog/is-online-mba-worth-it-2026,1
affordable-online-mba-india-2026,Best Affordable Online MBA in India 2026 — A Straight-Talk Guide,64,yes,yes,"Looking for an affordable online MBA in India in 2026? Compare fees from ₹54K to ₹1.5L, check UGC ap...",157,yes,yes,https://edifyedu.in/blog/affordable-online-mba-india-2026,1
online-mba-for-working-professionals-india,Online MBA for Working Professionals in India 2026: What to Check Before You Pay,80,yes,yes,5 years into your career and thinking about an online MBA? Here is what actually separates a good pr...,161,yes,yes,https://edifyedu.in/blog/online-mba-for-working-professionals-india,1
symbiosis-online-mba-review-2026,"Symbiosis Online MBA 2026: Fees, Program Details and Student Feedback",69,yes,yes,"Symbiosis SSODL Online MBA fees 2026: ₹3,70,000 total. NIRF Mgmt 11 (top-tier), NAAC A++ (3.56), AAC...",157,yes,yes,https://edifyedu.in/blog/symbiosis-online-mba-review-2026,1
nmims-online-mba-review-2026,"NMIMS Online MBA 2026: Honest Review of Fees, Specialisations, Placements and What Students Actually Say",104,yes,yes,"NMIMS Online MBA fees 2026: ₹1.96L to ₹2.2L. NIRF Management rank 24, NAAC A++ (3.67), AACSB accredi...",147,yes,yes,https://edifyedu.in/blog/nmims-online-mba-review-2026,1
career-after-bcom-jobs-salary-courses-2026,"Career After B.Com 2026: Top 10 Courses, Jobs, Salary and CA vs MBA Comparison",78,yes,yes,"Career after B.Com in India 2026 - top 10 courses with fees, government jobs list, entry to senior s...",167,yes,yes,https://edifyedu.in/blog/career-after-bcom-jobs-salary-courses-2026,1
1-year-mba-india-executive-mba-2026,1 Year MBA India 2026: The Degree vs Diploma Distinction and Real Tier Picker,77,yes,yes,"1 year MBA India 2026: IIMA PGPX Rs 35L, ISB Rs 38L, IIMB EPGP Rs 33.71L, BITS WILP Rs 3.5L, JGU 1-y...",134,yes,yes,https://edifyedu.in/blog/1-year-mba-india-executive-mba-2026,1
mba-fees-india-complete-guide-2026,MBA Fees India 2026: Complete Cost Guide with Hidden Cost Breakdown,67,yes,yes,"MBA fees India 2026 complete guide: IIM Rs 27L, ISB Rs 45L, private Rs 8-25L, online Rs 31K-2.25L. H...",141,yes,yes,https://edifyedu.in/blog/mba-fees-india-complete-guide-2026,1
career-after-12th-arts-courses-jobs-2026,"Career After 12th Arts 2026: Best Courses, Jobs and Salary Complete Guide",73,yes,yes,"Career after 12th arts in India 2026: best courses, jobs with high salary, BA, BBA, BCA options, and...",129,yes,yes,https://edifyedu.in/blog/career-after-12th-arts-courses-jobs-2026,1
mba-after-bca-is-it-good-career-2026,MBA After BCA 2026: The Tech-Plus-Management Stack and Real Salary Curve,72,yes,yes,"MBA after BCA 2026: yes, with conditions. Best specs (Business Analytics, IT Mgmt), 10-year salary c...",148,yes,yes,https://edifyedu.in/blog/mba-after-bca-is-it-good-career-2026,1
best-mba-specialization-india-2026,Best MBA Specialization in India 2026: Which to Choose for Maximum Salary?,74,yes,yes,Complete guide to best MBA specialization in India 2026. Compare MBA Finance vs Marketing vs Data Sc...,163,yes,yes,https://edifyedu.in/blog/best-mba-specialization-india-2026,1
career-after-12th-commerce-courses-jobs-2026,Career After 12th Commerce 2026: The Exam Path vs Degree Path Decision,70,yes,yes,"Career after 12th commerce 2026: CA vs BBA vs ACCA vs CS decision framework, Maths vs no-Maths impac...",139,yes,yes,https://edifyedu.in/blog/career-after-12th-commerce-courses-jobs-2026,1
mba-after-bsc-is-it-good-2026,MBA After BSc 2026: The Science-Plus-Management Stack and 10-Year Curve,71,yes,yes,"MBA after BSc India 2026: BSc CS to Data Science Rs 10-18L, BSc Maths to Analytics, BSc Bio to Healt...",151,yes,yes,https://edifyedu.in/blog/mba-after-bsc-is-it-good-2026,1
online-mba-without-entrance-exam-india-2026,Online MBA Without Entrance Exam 2026: Why It Exists and Who It Actually Suits,78,yes,yes,"Online MBA without entrance exam India 2026: UGC-DEB direct admission options, why exam-less program...",155,yes,yes,https://edifyedu.in/blog/online-mba-without-entrance-exam-india-2026,1
mat-exam-2026-eligibility-pattern-dates,"MAT Exam 2026: Eligibility, Paper Pattern, Dates and Score Card Explained",73,yes,yes,"MAT exam 2026: eligibility, exam pattern, syllabus, important dates, registration process, and MBA c...",129,yes,yes,https://edifyedu.in/blog/mat-exam-2026-eligibility-pattern-dates,1
cmat-exam-2026-guide-eligibility-pattern,"CMAT Exam 2026: Eligibility, Pattern, Score, Dates and Colleges Accepting CMAT",78,yes,yes,"CMAT exam 2026: eligibility, exam pattern, syllabus, preparation tips, and top MBA colleges acceptin...",123,yes,yes,https://edifyedu.in/blog/cmat-exam-2026-guide-eligibility-pattern,1
mba-entrance-exams-india-2026,"MBA Entrance Exams India 2026: CAT, MAT, CMAT, XAT, ATMA Compared",65,yes,yes,"Compare all major MBA entrance exams in India 2026: CAT, MAT, CMAT, XAT, ATMA, GMAT. Difficulty, fre...",169,yes,yes,https://edifyedu.in/blog/mba-entrance-exams-india-2026,1
ugc-deb-approved-universities-list-2026,UGC DEB Approved Universities List 2026: How to Verify Before You Enroll,72,yes,yes,Complete guide to UGC DEB approved universities for online degrees in India 2026. What approval mean...,164,yes,yes,https://edifyedu.in/blog/ugc-deb-approved-universities-list-2026,1
mba-vs-pgdm-online-india-2026,MBA vs PGDM in India 2026: Key Differences and Which Is Better for You,70,yes,yes,"PGDM vs MBA in India 2026: difference between AICTE diploma and UGC degree, fees, salary, government...",146,yes,yes,https://edifyedu.in/blog/mba-vs-pgdm-online-india-2026,1
online-mba-pune-university-2026,"Online MBA in Pune 2026: SPPU, Symbiosis SCDL and Top Programs Compared",71,yes,yes,"Online MBA Pune university 2026: UGC-approved programs, fees, Symbiosis SSODL, Parul, and top option...",131,yes,yes,https://edifyedu.in/blog/online-mba-pune-university-2026,1
is-online-degree-valid-india-2026,"Is Online Degree Valid in India 2026? UGC, Employers and Courts Say Yes",71,yes,yes,"Is online degree valid in India 2026? UGC-DEB approved degrees, government job eligibility, PSU rule...",134,yes,yes,https://edifyedu.in/blog/is-online-degree-valid-india-2026,1
mba-after-engineering-india-2026,MBA After Engineering in India 2026: Is It Worth It and Which Specialisation?,77,yes,yes,"MBA after engineering in India 2026: is it worth it, best specialisations for engineers, salary jump...",131,yes,yes,https://edifyedu.in/blog/mba-after-engineering-india-2026,1
mba-marketing-career-salary-jobs-2026,MBA Marketing Career India 2026: Digital Premium and D2C Track Decoded,70,yes,yes,"MBA Marketing career India 2026: Rs 12.2 LPA median, 20% digital premium, D2C track, FMCG vs SaaS pa...",141,yes,yes,https://edifyedu.in/blog/mba-marketing-career-salary-jobs-2026,1
distance-mba-bangalore-2026,Distance MBA Bangalore 2026: Tech Park Picker and Local Network Map,67,yes,yes,"Distance MBA Bangalore 2026: Whitefield vs Koramangala vs ORR job market map, JAIN A++ vs Christ vs ...",138,yes,yes,https://edifyedu.in/blog/distance-mba-bangalore-2026,1
mba-data-science-analytics-career-2026,MBA Data Science and Analytics Career and Salary India 2026,59,yes,yes,"MBA Data Science and Analytics career guide for India 2026. Top job roles, salary data, which compan...",182,yes,yes,https://edifyedu.in/blog/mba-data-science-analytics-career-2026,1
online-mba-for-freshers-india-2026,Online MBA for Freshers India 2026: When It Pays Off vs Wait for Work-Ex,72,yes,yes,"Online MBA for freshers India 2026: 5-situation test for fresher MBA decision, ROI math vs waiting, ...",142,yes,yes,https://edifyedu.in/blog/online-mba-for-freshers-india-2026,1
online-mba-eligibility-criteria-india-2026,Online MBA Eligibility Criteria India 2026: The 45% Fix and Other Workarounds,77,yes,yes,"Online MBA eligibility India 2026: 50% UGC norm, 45% reserved relaxation, 40% Amity exception, work-...",147,yes,yes,https://edifyedu.in/blog/online-mba-eligibility-criteria-india-2026,1
mba-or-mca-which-is-better-2026,MBA or MCA Which Is Better 2026: The Career Trajectory and Salary Curve Decoded,79,yes,yes,"MBA or MCA 2026: management vs technical career, Rs 6-25 LPA vs Rs 4-30 LPA salary curve, MCA plus M...",134,yes,yes,https://edifyedu.in/blog/mba-or-mca-which-is-better-2026,1
top-free-online-mba-courses-2026,Free Online MBA Courses 2026: Build a Self-Directed Curriculum (Plus the Trap),78,yes,yes,"Free online MBA courses 2026: build a 12-month self-directed MBA from Wharton, MIT, Harvard, IIM SWA...",143,yes,yes,https://edifyedu.in/blog/top-free-online-mba-courses-2026,1
online-executive-mba-india-2026,"Online Executive MBA India 2026: The ""Executive Label"" Trap and Real Options",76,yes,yes,"Online executive MBA India 2026: which programs are real exec MBAs vs rebranded online MBAs, sponsor...",153,yes,yes,https://edifyedu.in/blog/online-executive-mba-india-2026,1
online-executive-mba-iim-2026,Online Executive MBA from IIM 2026: Which Programs Are Actually Online,70,yes,yes,"Online Executive MBA from IIM 2026: which IIM programmes are actually online (BPGP), which are resid...",149,yes,yes,https://edifyedu.in/blog/online-executive-mba-iim-2026,1
is-distance-mba-worth-it-india-2026,Is Distance MBA Worth It India 2026? The 5-Situation Test Nobody Runs,69,yes,yes,"Is distance MBA worth it India 2026? ROI by career stage, salary uplift data, when distance vs onlin...",147,yes,yes,https://edifyedu.in/blog/is-distance-mba-worth-it-india-2026,1
distance-mba-colleges-mumbai-2026,"Distance MBA Colleges in Mumbai 2026: Top Programs, Fees and Eligibility",72,yes,yes,"Distance MBA colleges in Mumbai 2026: UGC-approved programs, fees, top institutions, and how to shor...",124,yes,yes,https://edifyedu.in/blog/distance-mba-colleges-mumbai-2026,1
du-online-mba-delhi-university-2026,"DU Online MBA 2026: Delhi University SOL MBA Eligibility, Fees and Process",74,yes,yes,"Delhi University online MBA 2026: DU SOL MBA program, fees, eligibility, recognition, and how it com...",134,yes,yes,https://edifyedu.in/blog/du-online-mba-delhi-university-2026,1
mba-international-online-global-programs-2026,MBA International Online 2026: AACSB Tier Plus UWA-IIMK and PSB Decoded,71,yes,yes,"International online MBA 2026 for Indian students: UWA Global MBA Rs 5.95L with IIMK, Paris School R...",151,yes,yes,https://edifyedu.in/blog/mba-international-online-global-programs-2026,1
top-online-mba-india-2026,Top Online MBA India 2026: The Best-For-What Tiering Nobody Publishes,69,yes,yes,"Top online MBA India 2026: best-for-what picker (BFSI, tech, FMCG), UGC auto-approval rule (NAAC 3.2...",144,yes,yes,https://edifyedu.in/blog/top-online-mba-india-2026,1
distance-mba-meaning-what-is-it-2026,Distance MBA Meaning: What Is a Distance MBA and How Does It Work?,66,yes,yes,"What is a distance MBA? Complete guide to distance MBA meaning, how it differs from online and corre...",169,yes,yes,https://edifyedu.in/blog/distance-mba-meaning-what-is-it-2026,1
ma-distance-learning-india-2026,MA Distance Learning India 2026: 43-Spec IGNOU Plus Career-Aligned Picker,73,yes,yes,"MA distance learning India 2026: IGNOU 43 specialisations Rs 8K-27K, private online MA, specialisati...",140,yes,yes,https://edifyedu.in/blog/ma-distance-learning-india-2026,1
top-correspondence-mba-colleges-india-2026,Top Correspondence MBA Colleges India 2026: Tier-by-Tier Picker with Live Fees,78,yes,yes,"Top correspondence MBA colleges India 2026: 3-tier picker (premium, mid, budget), IGNOU Rs 31.5K to ...",140,yes,yes,https://edifyedu.in/blog/top-correspondence-mba-colleges-india-2026,1
online-mba-vs-distance-mba-difference-2026,Online MBA vs Distance MBA Difference 2026: The 11-Factor Comparison,68,yes,yes,"Online MBA vs distance MBA difference 2026: regulatory split (Online vs ODL Regulations), live class...",148,yes,yes,https://edifyedu.in/blog/online-mba-vs-distance-mba-difference-2026,1
correspondence-mba-meaning-2026,Correspondence MBA Meaning 2026: The Word Is Retired but the Confusion Is Not,77,yes,yes,"Correspondence MBA meaning India 2026: the old name for ODL/distance MBA, why UGC retired the term, ...",139,yes,yes,https://edifyedu.in/blog/correspondence-mba-meaning-2026,1
