slug,title,title_length,title_keyword_present,title_unique,meta_desc,meta_desc_length,meta_keyword_present,meta_unique,canonical_url,total_issues
top-executive-mba-programs-india-2026,Top Executive MBA Programs India 2026: The 4-Tier Picker Nobody Publishes,73,yes,yes,"Top Executive MBA programs India 2026: tier-by-tier picker (Rs 33L IIM B EPGP to Rs 1.5L online), se...",146,yes,yes,https://edifyedu.in/blog/top-executive-mba-programs-india-2026,1
online-mba-fee-comparison-india-2026,Online MBA Fee Comparison India 2026: Every Major University in One Place,73,yes,yes,"Standardised online MBA fee comparison India 2026. From Rs 76,200 (Galgotias) to Rs 2,92,000 (MAHE)....",165,yes,yes,https://edifyedu.in/blog/online-mba-fee-comparison-india-2026,1
jamia-hamdard-mba-2026,Jamia Hamdard MBA 2026: The Delhi Online MBA Nobody Compares Honestly,69,yes,yes,"Jamia Hamdard online MBA 2026: ~Rs 1.03L total, NAAC A+, NIRF 47 (University), Hospital and Healthca...",145,yes,yes,https://edifyedu.in/blog/jamia-hamdard-mba-2026,1
is-mba-post-graduation-india-2026,"Is MBA Post Graduation India 2026? Yes, Here is Why",51,yes,yes,"Is MBA post graduation in India 2026? Yes — what it means for government jobs, UPSC eligibility, PhD...",150,yes,yes,https://edifyedu.in/blog/is-mba-post-graduation-india-2026,1
amity-online-mba-review-2026,"Amity Online MBA 2026: Fees, Review, 19 Specializations & Honest Assessment",75,yes,yes,"Amity Online MBA fees 2026: ₹2,07,000 one-time (saving ₹18,000 off list price). NAAC A+, NIRF Mgmt 4...",145,yes,yes,https://edifyedu.in/blog/amity-online-mba-review-2026,1
online-mca-course-india,"Online MCA Course in India: Fees, Colleges and Career Scope 2026",64,yes,yes,"Online MCA course in India 2026 — fees from Rs.50,000 to Rs.2.2L, top UGC-approved colleges, special...",167,yes,yes,https://edifyedu.in/blog/online-mca-course-india,1
amity-online-mca-fees-review,"Amity Online MCA: Fees, Specialisations and Honest Review 2026",62,yes,yes,"Amity online MCA fees are Rs 1.7 lakh total (Rs 42,500 per semester). Complete review of all 6 speci...",194,yes,yes,https://edifyedu.in/blog/amity-online-mca-fees-review,1
uu-doon-online-mba-review,"Uttaranchal University Online MBA 2026: Fees, Syllabus, Specializations and Honest Review",89,yes,yes,"UU Doon Online MBA at Rs. 94,000 total (after 30% scholarship). NAAC A+, Dehradun. Full fee breakdow...",158,yes,yes,https://edifyedu.in/blog/uu-doon-online-mba-review,1
galgotias-online-mba-review,"Galgotias Online MBA 2026: Fees, Syllabus, Specializations and Honest Review",76,yes,yes,"Galgotias University Online MBA at Rs. 76,200 total. NAAC A+, Greater Noida. Full fee breakdown, 7 s...",166,yes,yes,https://edifyedu.in/blog/galgotias-online-mba-review,1
noida-international-university-online-mba-review,"Noida International University Online MBA 2026: Fees, 10 Specializations, Syllabus and Honest Review",100,yes,yes,"NIU Online MBA at Rs. 88,500 after early-bird discount. NAAC A+, Greater Noida. 10 specializations, ...",168,yes,yes,https://edifyedu.in/blog/noida-international-university-online-mba-review,1
shoolini-online-mba-review,"Shoolini Online MBA 2026: Fees, 16 Specializations, Pay After Placement and Honest Review",89,yes,yes,"Shoolini Online MBA at Rs. 1,30,000 (or Rs. 1,18,000 PAP). QS #1 Private University India. 16 MBA sp...",167,yes,yes,https://edifyedu.in/blog/shoolini-online-mba-review,1
dy-patil-online-mba-review,"DY Patil Online MBA Pune 2026: WES Recognition, edX Harvard MIT Access and Honest Review",88,yes,yes,"Dr. DY Patil Vidyapeeth Pune Online MBA fees 2026: ₹1,89,400. NAAC A++ (3.64), NIRF University rank ...",157,yes,yes,https://edifyedu.in/blog/dy-patil-online-mba-review,1
chandigarh-university-online-mba-review,"Chandigarh University Online MBA 2026: Harvard PwC PMI Certifications, 23 Specializations Reviewed",98,yes,yes,"Chandigarh University Online MBA fees 2026: ₹1,65,000 total. NIRF Management rank 32, NAAC A+ (3.28)...",161,yes,yes,https://edifyedu.in/blog/chandigarh-university-online-mba-review,1
mba-full-form-course-details-eligibility-fees-2026,"MBA Full Form: What is MBA, Eligibility, Fees, Specializations, Salary 2026",75,yes,yes,"MBA stands for Master of Business Administration. Full guide on MBA eligibility, fees (40K-25L), top...",166,yes,yes,https://edifyedu.in/blog/mba-full-form-course-details-eligibility-fees-2026,1
bca-full-form-course-details-eligibility-fees-2026,"BCA Full Form: What is BCA, Course Details, Subjects, Fees, Salary 2026",71,yes,yes,"BCA stands for Bachelor of Computer Applications. Full guide on BCA course, subjects, eligibility, f...",153,yes,yes,https://edifyedu.in/blog/bca-full-form-course-details-eligibility-fees-2026,1
bba-full-form-course-details-eligibility-fees-2026,"BBA Full Form: What is BBA, Course Details, Subjects, Fees, Salary 2026",71,yes,yes,"BBA stands for Bachelor of Business Administration. Full guide on BBA course, subjects, fees (50K-5L...",155,yes,yes,https://edifyedu.in/blog/bba-full-form-course-details-eligibility-fees-2026,1
mca-full-form-course-details-eligibility-fees-2026,"MCA Full Form: What is MCA, Course Details, Subjects, Fees, Salary 2026",71,yes,yes,"MCA stands for Master of Computer Applications. Full guide on MCA course, subjects, eligibility, fee...",151,yes,yes,https://edifyedu.in/blog/mca-full-form-course-details-eligibility-fees-2026,1
ma-full-form-course-details-eligibility-fees-2026,"MA Full Form: What is MA, Specializations, Subjects, Fees, Salary 2026",70,yes,yes,"MA full form is Master of Arts, a two-year PG degree in humanities and social sciences. See subjects...",162,yes,yes,https://edifyedu.in/blog/ma-full-form-course-details-eligibility-fees-2026,1
ignou-online-mba-review-2026,IGNOU Online MBA: Is It Still Worth It in 2026?,47,yes,yes,"IGNOU Online MBA fees 2026: ₹58,000 total (₹14,000 × 3 semesters + ₹16,000 for semester 3). AICTE re...",158,yes,yes,https://edifyedu.in/blog/ignou-online-mba-review-2026,0
online-manipal-mba-review-2026,Online Manipal MBA Review 2026: MAHE vs MUJ vs SMU Compared,59,yes,yes,"Compare Online Manipal MBA from MAHE, MUJ and SMU on fees, specialisations, rankings and student fee...",135,yes,yes,https://edifyedu.in/blog/online-manipal-mba-review-2026,0
mahe-online-mba-review-2026,"MAHE Online MBA: Fees, Specialisations and Review 2026",54,yes,yes,"Manipal Academy of Higher Education (MAHE) Online MBA fees 2026: ₹2,92,000. NIRF Management rank 39,...",156,yes,yes,https://edifyedu.in/blog/mahe-online-mba-review-2026,0
muj-online-mba-review-2026,"MUJ Online MBA: Fees, 13 Specialisations and Review 2026",56,yes,yes,"Manipal University Jaipur (MUJ) Online MBA fees 2026: ₹1,80,000 total (₹45,000 per semester × 4) plu...",152,yes,yes,https://edifyedu.in/blog/muj-online-mba-review-2026,0
is-manipal-university-jaipur-fake-or-legit-2026,Is Manipal University Jaipur Fake or Legit? (2026 Proof),56,yes,yes,"Manipal University Jaipur (MUJ) is NOT fake. UGC-recognised since 2011, NAAC A+, NIRF Management ran...",157,yes,yes,https://edifyedu.in/blog/is-manipal-university-jaipur-fake-or-legit-2026,0
online-mba-salary-india-2026,Online MBA Salary in India 2026: What to Expect After Your Degree,65,yes,yes,"Online MBA salary in India 2026: average packages by specialisation, university, and experience. Wha...",131,yes,yes,https://edifyedu.in/blog/online-mba-salary-india-2026,0
online-mba-lpu-review-2026,"LPU Online MBA Review 2026: Fees, Specialisations and Honest Take",65,yes,yes,"LPU Online MBA fees 2026: ₹40,400 per semester (₹1,61,600 total) with 20 percent student grant. NIRF...",156,yes,yes,https://edifyedu.in/blog/online-mba-lpu-review-2026,0
distance-mba-kolkata-top-programs-2026,"Best Distance MBA in Kolkata 2026: Top Programs, Fees and Tips",62,yes,yes,"Distance MBA in Kolkata 2026: top UGC-approved programs, fees, colleges, and how to choose the right...",124,yes,yes,https://edifyedu.in/blog/distance-mba-kolkata-top-programs-2026,0
online-mba-delhi-ncr-2026,Online MBA Delhi NCR 2026: The Sub-Region Job Market Picker,59,yes,yes,"Online MBA Delhi NCR 2026: Noida vs Delhi vs Gurgaon vs Faridabad job market mapping, NAAC A+ option...",146,yes,yes,https://edifyedu.in/blog/online-mba-delhi-ncr-2026,0
online-mba-admission-process-india-2026,Online MBA Admission Process India 2026: The Month-by-Month Plan,64,yes,yes,"Online MBA admission process India 2026: 8 steps, month-by-month timeline, document checklist, commo...",143,yes,yes,https://edifyedu.in/blog/online-mba-admission-process-india-2026,0
mba-scope-india-2026,MBA Scope in India 2026: The Sector Hiring Data Nobody Publishes,64,yes,yes,"MBA scope India 2026: actual FY26 sector hiring numbers, growing vs shrinking industries, brand x sp...",148,yes,yes,https://edifyedu.in/blog/mba-scope-india-2026,0
mba-vs-bba-which-is-better-2026,"MBA vs BBA Which Is Better 2026: Salary, Path & Honest Pick",59,yes,yes,"MBA vs BBA which is better 2026: stage-by-stage comparison of duration, fees, salary at 0/3/5/10 yea...",157,yes,yes,https://edifyedu.in/blog/mba-vs-bba-which-is-better-2026,0
online-mba-government-employees-india-2026,Online MBA for Government Employees India: NOC + Promotion,58,yes,yes,"Online MBA for government employees India 2026: CCS NOC rules, four promotion paths, UGC-DEB univers...",159,yes,yes,https://edifyedu.in/blog/online-mba-government-employees-india-2026,0
mba-operations-management-career-2026,MBA Operations Management Career 2026: Honest Salary Guide,58,yes,yes,"MBA Operations Management career 2026: four career tracks, real Amazon and Flipkart salaries, UGC-DE...",151,yes,yes,https://edifyedu.in/blog/mba-operations-management-career-2026,0
mba-international-business-career-2026,"MBA International Business Career 2026: Salary, Jobs & Truth",60,yes,yes,"MBA International Business career India 2026: five career tracks, real salaries up to Rs 60L, UGC-DE...",151,yes,yes,https://edifyedu.in/blog/mba-international-business-career-2026,0
mba-digital-marketing-career-2026,MBA Digital Marketing Career 2026: Salary & 5 Tracks,52,yes,yes,"MBA Digital Marketing career 2026: five career tracks, real salaries up to Rs 60L, UGC-DEB universit...",157,yes,yes,https://edifyedu.in/blog/mba-digital-marketing-career-2026,0
distance-mba-chennai-2026,"Distance MBA Chennai 2026: Top Universities, Fees & Salary",58,yes,yes,"Distance MBA Chennai 2026: Tamil Nadu UGC-DEB universities (VIT, SASTRA, Bharathidasan), Chennai IT ...",152,yes,yes,https://edifyedu.in/blog/distance-mba-chennai-2026,0
distance-mba-hyderabad-2026,"Distance MBA Hyderabad 2026: Fees, Universities & ROI Truth",59,yes,yes,"Distance MBA Hyderabad 2026: ICFAI, BRAOU and national UGC-DEB options for HITEC City IT, pharma and...",157,yes,yes,https://edifyedu.in/blog/distance-mba-hyderabad-2026,0
online-mba-ahmedabad-gujarat-2026,"Online MBA Ahmedabad Gujarat 2026: Fees, Universities & ROI",59,yes,yes,"Online MBA Ahmedabad Gujarat 2026: Gujarat-based and national UGC-DEB universities, GIFT City BFSI r...",158,yes,yes,https://edifyedu.in/blog/online-mba-ahmedabad-gujarat-2026,0
icfai-online-mba-fees-2026,ICFAI Online MBA Fees: What to Verify Before You Apply in 2026,62,yes,yes,"ICFAI online MBA fees, specialisations, UGC approval status, and how it compares to JAIN Online, Cha...",160,yes,yes,https://edifyedu.in/blog/icfai-online-mba-fees-2026,0
icfai-distance-mba-2026,ICFAI Distance MBA 2026: The Self-Paced Model and Who It Suits,62,yes,yes,"ICFAI distance MBA 2026: the self-paced workbook model, UGC-DEB approval check, ODL alternatives lik...",135,yes,yes,https://edifyedu.in/blog/icfai-distance-mba-2026,0
vignan-online-mba-review,"Vignan Online MBA 2026: Fees, Syllabus, Honest Review",53,yes,yes,"Vignan Online MBA at Rs. 90,000 total. NAAC A+ ranked. Full fee breakdown, semester-wise syllabus, 7...",155,yes,yes,https://edifyedu.in/blog/vignan-online-mba-review,0
bsc-full-form-course-details-eligibility-fees-2026,"BSc Full Form: What is BSc, Branches, Subjects, Fees, Salary 2026",65,yes,yes,"BSc stands for Bachelor of Science. Full guide on BSc branches, subjects, eligibility, fees (5K-2L),...",160,yes,yes,https://edifyedu.in/blog/bsc-full-form-course-details-eligibility-fees-2026,0
best-online-mba-colleges-india-2026,Best Online MBA Colleges in India 2026: Top 15 UGC-DEB Ranked,61,yes,yes,"Best online MBA colleges in India 2026: Top 15 UGC-DEB universities ranked by NIRF, NAAC, fees ₹66K-...",162,yes,yes,https://edifyedu.in/blog/best-online-mba-colleges-india-2026,0
is-online-mba-valid-india-2026,Is Online MBA Valid in India 2026? UGC and Employers Say Yes,60,yes,yes,"Is online MBA valid in India 2026? Yes, UGC-DEB approved online MBA = on-campus MBA. Government jobs...",154,yes,yes,https://edifyedu.in/blog/is-online-mba-valid-india-2026,0
online-mba-with-placement-india-2026,Online MBA with Placement in India 2026: Universities Compared,62,yes,yes,"Online MBA with placement India 2026: NMIMS, Symbiosis, Amity, Chandigarh, MUJ placement reality. Ho...",156,yes,yes,https://edifyedu.in/blog/online-mba-with-placement-india-2026,0
amrita-online-bba-review-2026,"Amrita Online BBA Review 2026: AHEAD Fees, Honest Take",54,yes,yes,"Amrita online BBA review 2026: AHEAD programme ₹1,41,000 fees, NIRF top tier, NAAC A++, Amrita Vishw...",160,yes,yes,https://edifyedu.in/blog/amrita-online-bba-review-2026,0
best-online-bba-colleges-india-2026,"Best Online BBA Colleges India 2026: NIRF Rank, Tier Verdict",60,yes,yes,Best online bba colleges india 2026: 11 UGC-DEB approved universities ranked across Tier 1 (Symbiosi...,159,yes,yes,https://edifyedu.in/blog/best-online-bba-colleges-india-2026,0
lpu-online-bba-review-2026,"LPU Online BBA Review 2026: Fees, 20% Grant, Honest Take",56,yes,yes,"LPU online BBA review 2026: ₹1,22,400 net fees with 20% grant, NIRF #38, NAAC A++, Lovely Profession...",151,yes,yes,https://edifyedu.in/blog/lpu-online-bba-review-2026,0
mahe-online-bba-review-2026,"MAHE Online BBA Review 2026: Fees, Honors Track, Honest Take",60,yes,yes,"MAHE online BBA review 2026: ₹1,80,000 fees, NIRF #4 institution, NAAC A++, BBA Honors 4-year track ...",156,yes,yes,https://edifyedu.in/blog/mahe-online-bba-review-2026,0
nmims-online-bba-review-2026,"NMIMS Online BBA Review 2026: Fees, BA Electives, Honest Take",61,yes,yes,"NMIMS online BBA review 2026: ₹1,50,000 standard or ₹1,80,000 BA electives, NIRF top 100, NAAC A++, ...",151,yes,yes,https://edifyedu.in/blog/nmims-online-bba-review-2026,0
online-bba-fees-india-2026,"Online BBA Fees India 2026: 11 University Comparison, EMI Guide",63,yes,yes,"Online bba fees india 2026: verified fee comparison across 11 UGC-DEB approved universities (₹30,900...",156,yes,yes,https://edifyedu.in/blog/online-bba-fees-india-2026,0
online-mba-fintech-india-2026,"Online MBA Fintech India 2026: Fees, Top Colleges, Salary Verdict",65,yes,yes,"Online mba fintech india 2026: top UGC-DEB approved colleges, fee ranges ₹31,500 to ₹1,99,000, UPI p...",160,yes,yes,https://edifyedu.in/blog/online-mba-fintech-india-2026,0
online-mba-hospitality-management-india-2026,"Online MBA Hospitality Management India 2026: Fees, Salary",58,yes,yes,"Online mba hospitality management india 2026: top UGC-DEB approved colleges, fee ranges ₹31,500 to ₹...",160,yes,yes,https://edifyedu.in/blog/online-mba-hospitality-management-india-2026,0
online-mba-logistics-management-india-2026,"Online MBA Logistics Management India 2026: Fees, Salary",56,yes,yes,"Online mba logistics management india 2026: top UGC-DEB approved colleges, verified fee ranges, care...",161,yes,yes,https://edifyedu.in/blog/online-mba-logistics-management-india-2026,0
online-mba-real-estate-management-india-2026,"Online MBA Real Estate Management India 2026: Fees, Salary",58,yes,yes,"Online mba real estate management india 2026: top UGC-DEB approved colleges, verified fee ranges ₹31...",159,yes,yes,https://edifyedu.in/blog/online-mba-real-estate-management-india-2026,0
symbiosis-online-bba-review-2026,"Symbiosis Online BBA Review 2026: Fees, SSODL, Honest Take",58,yes,yes,"Symbiosis online BBA review 2026: SSODL ₹1,65,000 fees, NIRF #19, NAAC A++, Symbiosis International ...",154,yes,yes,https://edifyedu.in/blog/symbiosis-online-bba-review-2026,0
